{"authority":{"aggregation_authorized":false,"attempts_per_task_id":1,"authorized_batch_count":6,"authorized_batch_ids":["M4-BATCH-NUC","M4-BATCH-MEC","M4-BATCH-ELE","M4-BATCH-AUT","M4-BATCH-COM","M4-BATCH-MPH"],"authorized_task_count":60,"authorized_task_ids":["M4-ELE-B-A2","M4-ELE-B-A1","M4-MEC-A-N","M4-NUC-A-F","M4-NUC-B-A1","M4-MPH-B-F","M4-MEC-A-A1","M4-COM-B-F","M4-MEC-B-F","M4-ELE-A-A1","M4-NUC-A-A1","M4-ELE-A-N","M4-COM-B-A1","M4-MPH-A-N","M4-MEC-A-A3","M4-AUT-B-A2","M4-MEC-B-A3","M4-AUT-B-A3","M4-MPH-A-A2","M4-ELE-A-F","M4-NUC-B-A3","M4-COM-B-A2","M4-MPH-A-A1","M4-AUT-A-A3","M4-AUT-B-A1","M4-COM-A-N","M4-NUC-A-A2","M4-COM-B-N","M4-COM-A-A3","M4-ELE-B-A3","M4-ELE-B-N","M4-AUT-A-A1","M4-AUT-B-N","M4-NUC-B-F","M4-MPH-A-A3","M4-AUT-A-A2","M4-NUC-A-N","M4-MPH-B-A2","M4-ELE-B-F","M4-MEC-B-A1","M4-MEC-B-A2","M4-COM-B-A3","M4-AUT-B-F","M4-NUC-B-A2","M4-NUC-A-A3","M4-MPH-A-F","M4-COM-A-A2","M4-COM-A-F","M4-MPH-B-N","M4-ELE-A-A3","M4-AUT-A-N","M4-COM-A-A1","M4-MEC-A-A2","M4-MEC-A-F","M4-MPH-B-A1","M4-MEC-B-N","M4-ELE-A-A2","M4-MPH-B-A3","M4-AUT-A-F","M4-NUC-B-N"],"blind_mapping_access_authorized":false,"closure_authorized":false,"fresh_contexts_authorized":60,"fresh_execution_authorized":true,"independent_finalizations_authorized":60,"judge_execution_authorized":false,"repair_authorized":false,"result_write_root_prefix":"evals/m4/results/m4.0","result_writes_authorized":true,"retry_authorized":false},"authorization_token":"sha256:09c940955104f2ae9278b55d155bc43a47d43a0eb9e80e4f90d7425eb3c0e292","batch_policy":{"batch_order":["M4-BATCH-NUC","M4-BATCH-MEC","M4-BATCH-ELE","M4-BATCH-AUT","M4-BATCH-COM","M4-BATCH-MPH"],"failure_preservation_required":true,"later_batches_mutable_after_observation":false,"stop_current_batch_on_infrastructure_or_protocol_failure":true,"successor_revision_required_after_failure":true,"tasks_per_batch":10},"consumption":{"authorization_token_status":"UNCONSUMED","claim_consumes_entire_matrix_authorization":true,"claim_count":0,"launch_claim_must_be_absent":true,"launch_claim_path":"evals/m4/execution/m4.0/launch-claim.json","partial_or_failed_matrix_requires_new_revision":true},"does_not_authorize":["a second attempt for any task ID","a retry, repair, continuation, or follow-up message","a task outside the frozen 60-task M4.0 matrix","cross-task or cross-arm result visibility","judge execution, blind-map access, or unblinding","result aggregation or acceptance-threshold claims","changes to cases, prompts, variants, rubric, thresholds, or randomization","M4 closure, M5, an experiment, simulation, training run, deployment, or control action"],"execution_surface":{"cross_task_result_visibility":false,"environment":"worktree","project_id":"ff35b25f-4644-41c8-9073-74c697559439","project_is_git_repository":true,"project_label":"engineering-research-copilot","starting_branch":"codex/m4-cross-engineering-forward-evaluation-one-shot-authorization","task_context_isolation":"ONE_NEW_THREAD_PER_TASK_ID","tool":"codex_app.create_thread"},"milestone":"M4","model_binding":{"configured_default_required":true,"exact_model_id":"gpt-5.6-sol","model_argument_policy":"OMIT_AND_VERIFY_CONFIGURED_DEFAULT","model_context_window_tokens":1050000,"model_max_output_tokens":128000,"official_model_reference":"https://developers.openai.com/api/docs/models/gpt-5.6-sol","reasoning_effort":"max","thinking_argument_policy":"OMIT_AND_VERIFY_CONFIGURED_DEFAULT"},"prelaunch_counters":{"authorized_tasks":0,"created_contexts":0,"dispatched_tasks":0,"finalizations":0,"judge_scores":0,"repairs":0,"results_observed":0,"retries":0,"unauthorized_side_effects":0},"preparation_baseline":{"ci_conclusion":"success","ci_run_id":31237480839,"head":"c56c3c1ab384f65e51a70e9582672c6320d19121","manifest_git_blob_oid":"196d19be1483b58f2f6f8bb67d76d9a3f8020d98","manifest_path":"evals/m4/preparation-manifest.json","manifest_raw_sha256":"1838412c690c2000544999e955e399b4429289a698aa9467129f43fb0cd1bb76"},"review":{"path":"evals/m4/authorization/gate-iv-review.json","raw_sha256":"344a7384b17b3ce95c26cca51e6d5cef9d3f2727e6ea34426b1812f7cd13df2b","status":"PASSED"},"revision":"M4.0","schema_version":"m4-execution-authorization-v1","status":"AUTHORIZED_UNCONSUMED"}
